{
  "version": "1.5.0",
  "_seq": 5,
  "complete": false,
  "story_id": "TEST-001",
  "requirement": "Test requirement",
  "domain_area": "backend",
  "risk_level": "MEDIUM",
  "previous_state": "",
  "story_state": "IMPLEMENTING",
  "active_component": "backend",
  "components": {
    "backend": {
      "story_state": "IMPLEMENTING",
      "conventions_hash": "ab12cd34",
      "conventions_section_hashes": {},
      "detected_versions": {
        "language_version": "1.9.0",
        "framework_version": "3.2.0"
      }
    }
  },
  "quality_cycles": 0,
  "test_cycles": 0,
  "verify_fix_count": 0,
  "validation_retries": 0,
  "total_retries": 2,
  "total_retries_max": 10,
  "stage_timestamps": {
    "preflight": "2026-01-01T00:00:00Z",
    "explore": "2026-01-01T00:02:00Z"
  },
  "last_commit_sha": "abc123def456",
  "preempt_items_applied": [],
  "preempt_items_status": {},
  "feedback_classification": "",
  "previous_feedback_classification": "",
  "feedback_loop_count": 0,
  "score_history": [60, 75],
  "convergence": {
    "phase": "correctness",
    "phase_iterations": 2,
    "total_iterations": 2,
    "plateau_count": 0,
    "last_score_delta": 15,
    "convergence_state": "IMPROVING",
    "phase_history": [],
    "safety_gate_passed": false,
    "safety_gate_failures": 0,
    "unfixable_findings": [],
    "diminishing_count": 0,
    "unfixable_info_count": 0
  },
  "integrations": {
    "linear": { "available": false, "team": "" },
    "playwright": { "available": false },
    "slack": { "available": false },
    "figma": { "available": false },
    "context7": { "available": false },
    "neo4j": { "available": false, "last_build_sha": "", "node_count": 0 }
  },
  "linear": {
    "epic_id": "",
    "story_ids": [],
    "task_ids": {}
  },
  "linear_sync": {
    "in_sync": true,
    "failed_operations": []
  },
  "modules": [],
  "cost": {
    "wall_time_seconds": 120,
    "stages_completed": 3
  },
  "recovery_budget": {
    "total_weight": 1.5,
    "max_weight": 5.5,
    "applications": []
  },
  "recovery": {
    "total_failures": 0,
    "total_recoveries": 0,
    "degraded_capabilities": [],
    "failures": [],
    "budget_warning_issued": false
  },
  "scout_improvements": 0,
  "evidence_refresh_count": 0,
  "conventions_hash": "",
  "conventions_section_hashes": {},
  "detected_versions": {},
  "check_engine_skipped": 0,
  "mode": "standard",
  "dry_run": false,
  "shallow_clone": false,
  "cross_repo": {},
  "spec": null,
  "ticket_id": null,
  "branch_name": "",
  "tracking_dir": null,
  "documentation": {},
  "bugfix": null,
  "graph": {
    "last_update_stage": -1,
    "last_update_files": [],
    "stale": false
  }
}
